"Соло";"Петроградский";"Петроградская";"197101, г.Санкт-Петербург, Большой проспект П.С., дом 51/9, литера А";"3*";"SOLO";"Сеть мини-отелей Solo";"17";"2006";"3 400";"4494219";"аренда автомобилей, заказ такси, прачечная, химчистка, организация туров и экскурсий, бронирование и заказ билетов в театры, на концерты";"кондиционер, телевизор, интернет Wi-Fi";"http://www.solo-hotel.ru/";"mailto: solo-hotel@mail.ru";"3086:01:15";"34";"";"Комитет по инвестициям";"муниципальный округ №59"
"БонОтель";"Петроградский";"Спортивная, Горьковская";"г.Санкт-Петербург, Съезжинская улица, дом 32, литера Б";"Мини-гостиница";"Бонотель";"";"7";"2008";"";"2320141";"буфет, автостоянка, трансфер, заказ такси, организация экскурсий";"ТВ со спутниковыми каналами, мини-бар, сейф, телефон, ванная комната с душевой кабиной, фен, туалетные принадлежности";"http://www.bonhotel.narod.ru";"нет";"3038:00:19";"20";"";"Комитет по инвестициям";"муниципальный округ Введенский"
"Соната на Большом";"Петроградский";"Петроградская";"197101, г.Санкт-Петербург, Большой проспект П.С., дом 51/9, литера А";"Мини-гостиница";"Sonata Hotels";"Sonata Hotels";"8";"2006";"";"3465404, 7089078";"аренда автомобилей, визовая поддержка, заказ такси, прачечная, химчистка, организация туров и экскурсий, бронирование и заказ билетов в театры, на концерты";"телефон, кабельное ТВ, интернет Wi-Fi, ванная комната";"http://www.hotel-sonata.com/,  http://www.hotel-sonata.ru";"mailto: info@hotel-sonata.com";"3086:01:15";"16";"";"Комитет по инвестициям";"муниципальный округ №59"
"Атмосфера";"Петроградский";"Спортивная";"г.Санкт-Петербург, улица Красного Курсанта, дом 9а";"Мини-гостиница";"Сеть отелей "Атмосфера"";"Сеть отелей "Атмосфера"";"8";"2004";"";"9747523";"аренда автомобилей, визовая поддержка, заказ такси, заказ авиа и ж/д билетов, организация туров и экскурсий";"телевизор, фен, гладильные принадлежности";"http://www.a-hotel.spb.ru/";"mailto: a-hotel@mail.ru";"3149:01:03";"24";"";"Комитет по инвестициям";"муниципальный округ №62"
"Прима Отель на Васильевском";"Василеостровский";"Василеостровская";"199053, г.Санкт-Петербург, 3-я линия В.О., дом 52, литера А";"Мини-гостиница";"Прима-Отель на Васильевском";"Soko Hotels";"10";"2009";"2 100";"3283266";"автостоянка, заказ такси, фитнес-клуб, салон красоты, сувенирные магазины, камера хранения багажа, прачечная, химчистка, заказ авиа и ж/д билетов, организация туров и экскурсий, бронирование и заказ билетов в театры, на концерты";"сейф, телефон, телевизор, кабельное ТВ, интернет кабельный";"http://www.prima-nomerov.net/";"mailto: inn@prima-nomerov.net";"2022:12:90";"20";"";"Комитет по инвестициям";"муниципальный округ Васильевский"
"СПБВЕРГАЗ";"Василеостровский";"Василеостровская";"199406, г.Санкт-Петербург, 7-я линия В.О., дом 70/18, литера А";"Эконом класс";"СПбВергаз";"";"20";"2005";"";"3278883";"аренда конференц-залов, визовая поддержка, автостоянка, заказ такси, сауна, кафе, прачечная, бронирование ж/д и авиабилетов, заказ билетов в театры";"телевизор, спутниковое ТВ, ванная комната, интернет";"http://www.vergaz.spb.ru/";"mailto: hotel@vergaz.spb.ru";"2035:25:62";"46";"";"Комитет по инвестициям";"муниципальный округ Васильевский"
"Пирамида";"Петроградский";"Спортивная, Горьковская";"197198, г.Санкт-Петербург, Зверинская улица, дом 42, литера А";"3* Мини-гостиница";"";"";"5";"2006";"";"9 360 300";"";"";"http://www.motelspb.com/";"";"3046:3:73";"0";"";"Комитет по инвестициям";"муниципальный округ Введенский"
"Чайковский";"Центральный";"Невский проспект/Гостиный двор";"г.Санкт-Петербург, Малая Морская улица, дом 7, литера А";"Мини-гостиница";"Чайковский";"";"4";"2005";"5 000";"3350988";"автостоянка, заказ такси, сейф ,визовая поддержка, химчистка, прачечная, заказ билетов в театры, на концерты";"мини-бар, телевизор, видео, холодильник, ванная комната";"http://www.tchaikovsky-hotel.narod.ru/index.html";"mailto: Tchaikovsky-hotel@yandex.ru";"1095:11:05";"10";"";"Комитет по инвестициям";"муниципальный округ №78"
"Амулет на Малой Морской";"Центральный";"Невский проспект/Гостиный двор";"г.Санкт-Петербург, Малая Морская улица, дом 7, литера А";"Мини-гостиница";"Амулет";"ГК "Амулет"";"7";"2004";"";"3154764, 5701732";"визовая поддержка, заказ такси, организация туров и экскурсий, бронирование и заказ билетов в театры, на концерты";"телефон, мини-бар, телевизор, фен, утюг, банные принадлежности, круглосуточное обслуживание в номере, душ, туалет";"http://www.amulet-hotels.ru/";"mailto: info@amulet-hotels.ru";"1095:11:05";"15";"";"Комитет по инвестициям";"муниципальный округ №78"
"B&B Адмиралтейская";"Центральный";"Невский проспект/Гостиный двор";"г.Санкт-Петербург, Малая Морская улица, дом 7, литера А";"Мини-гостиница";"B&B Адмиралтейская";"Randhouse";"3";"2003";"3 400";"5704597";"заказ такси, прачечная, химчистка, заказ авиа и ж/д билетов";"фен, утюг, халат, тапочки, банные принадлежности, гладильные принадлежности, рабочий стол, душ, ванная комната";"http://www.randhouse.ru/";"mailto: randhouse@mail.ru";"1095:11:05";"6";"";"Комитет по инвестициям";"муниципальный округ №78"
"Гостиница на Шевченко (СПБГУ общежитие)";"Василеостровский";"Приморская";"199406, г.Санкт-Петербург, улица Шевченко, дом 25, литера А";"Эконом класс";"ГОУ ВПО СПБГУ";"ГОУ ВПО СПБГУ";"320";"";"";"3550096";"нет";"интернет кабельный, утюг, гладильные принадлежности";"http://www.spbu.ru/candidate/studgorodok, http://www.campus.spbu.ru";"нет";"2108:05:44";"539";"";"Комитет по инвестициям";"муниципальный округ №9"
"Freedom";"Василеостровский";"Приморская";"199226, г.Санкт-Петербург, улица Нахимова, дом 7, корпус 2, литера А";"Мини-гостиница";"Freedom";"";"5";"2008";"3 200";"7166103";"автостоянка, камера хранения багажа, прачечная, химчистка, заказ авиа и ж/д билетов, бар, вызов такси, бар, сейф, заказ и бронирование билетов в театры, spa-комплекс";"кондиционер, радио, телефон, телевизор, кабельное ТВ, видео, интернет кабельный, интернет Wi-Fi, фен, утюг, холодильник, тапочки, банные принадлежности, гладильные принадлежности, круглосуточное обслуживание в номере, размещение домашних животных, рабочий";"http://www.freedom-hotel.ru";"mailto: freedomm7@rambler.ru";"2201:9:69";"12";"";"Комитет по инвестициям";"муниципальное образование округ Морской"
"Дом Балтика";"Василеостровский";"Приморская";"г.Санкт-Петербург, улица Нахимова, дом 1, литера А";"Мини-гостиница";"Дом Балтика"";"";"13";"2003";"2 200";"3550523";"кухня, сейф, регистрация иностранных граждан";"телевизор, фен, утюг, холодильник, банные принадлежности, гладильные принадлежности, душ, туалет, ванная комната, звонок-"будильник"/будильник";"нет";"нет";"2201Б:0:34";"40";"";"Комитет по инвестициям";"муниципальное образование округ Морской"
"Отель Международных и деловых контактов";"Василеостровский";"Приморская";"199406, г.Санкт-Петербург, Опочинина улица, дом 16, литера А";"Мини-гостиница";"Отель Международных и деловых контактов";"";"9";"2009";"3 100";"7158151";"автостоянка, заказ такси, сейф, spa-центр, химчистка, прачечная";"сейф, кондиционер, телефон, мини-бар, телевизор, спутниковое ТВ, интернет Wi-Fi, фен, халат, рабочий стол, ванная комната, тапки";"http://www.mdk-hotel.spb.ru/";"mailto: info@mdk-hotel.spb.ru";"2118:00:08";"18";"";"Комитет по инвестициям";"муниципальный округ №9"
"Моне";"Василеостровский";"Приморская";"199155, г.Санкт-Петербург, Морская набережная, дом 17, корпус 2, литера А";"Мини-гостиница";"Моне";"";"6";"2006";"3 200";"4989958, 974 7720";"рестораны, заказ такси, заказ авиа и ж/д билетов, организация туров и экскурсий, бронирование и заказ билетов в театры, на концерты";"телевизор, банные принадлежности, рабочий стол, мини-холодильник, чайник";"http://www.hotelmone.ru";"mailto: hotelmonet@rambler.ru";"2204:00:35";"11";"";"Комитет по инвестициям";"муниципальное образование округ Морской"
"Капитанская";"Василеостровский";"Приморская";"199155, г.Санкт-Петербург, Капитанская улица, дом 3, литера А";"Эконом класс";"СПбГУ";"";"110";"1988";"";"352-24-28";"нет";"кондиционер, телефон, мини-бар, телевизор, интернет кабельный, интернет Wi-Fi, утюг, холодильник, халат, тапочки, банные принадлежности, гладильные принадлежности, рабочий стол, душ, ванна, туалет, кофеварка/электрический чайник, звонок-"будильник"/будиль";"http://www.spbu.ru/candidate/studgorodok,  http://www.campus.spbu.ru";"mailto: hotel@kapitanskaya.ru";"2203:00:32";"490";"";"Комитет по инвестициям";"муниципальный округ Остров Декабристов"
"Club MarInn";"Василеостровский";"Приморская";"199155, г.Санкт-Петербург, Морская набережная, дом 31, корпус 2, литера А";"Мини-гостиница";"Club MarInn";"";"9";"2005";"3 100";"3037704";"аренда конференц-залов, визовая поддержка, автостоянка, заказ такси, камера хранения багажа, заказ авиа и ж/д билетов, организация туров и экскурсий, бронирование и заказ билетов в театры, на концерты";"телефон, телевизор, кабельное ТВ, интернет кабельный, фен, холодильник, ванная комната";"http://www.clubmarin.ru/";"mailto: hotel@clubmarin.ru";"2203:00:47";"21";"";"Комитет по инвестициям";"муниципальный округ Остров Декабристов"
"Мини-отель на пр. Кима";"Василеостровский";"Приморская";"199057, г.Санкт-Петербург, проспект КИМа, дом 26, литера Б";"Мини-гостиница";"Мини-отель на пр. Кима";"";"5";"2008";"2 900";"3500172";"аренда автомобилей, вызов такси";"телевизор, кабельное ТВ, мини-холодильник, чайник";"http://www.miniotel.frhall.info";"нет";"2206А:0:26";"8";"";"Комитет по инвестициям";"муниципальный округ Остров Декабристов"
"Люко";"Василеостровский";"Приморская";"г.Санкт-Петербург, Наличная улица, дом 44, корпус 2, литера А";"Эконом класс";"Люко";"";"16";"2004";"";"3523600";"визовая поддержка, заказ такси, заказ авиа и ж/д билетов, организация туров и экскурсий, бронирование и заказ билетов в театры, на концерты, бар, прачечная";"кондиционер, телефон, телевизор, кабельное ТВ, фен, холодильник, банные принадлежности, интернтет Wi-Fi";"http://www.hotelluko.spb.ru";"mailto: hotelluko@km.ru";"2202:2004:130";"32";"";"Комитет по инвестициям";"муниципальный округ Остров Декабристов"
"Евразия";"Петроградский";"Чкаловская";"197136, г.Санкт-Петербург, Гатчинская улица, дом 5, литера А";"3*";"Группа Отелей Евразия";"Группа Отелей Евразия";"19";"2003";"4 900";"4980800";"визовая поддержка, камера хранения багажа, организация туров и экскурсий";"сейф, телефон, телевизор, видео, интернет Wi-Fi, звонок-«будильник»/ Будильник, круглосуточное обслуживание в номере, кухня, рабочий стол, душ, туалет, ванная комната";"http://www.eurasia-hotel.ru/";"mailto: eurasia@eurasia-hotel.ru";"3107:07:28";"38";"";"Комитет по инвестициям";"муниципальный округ №62"
"Кронверк";"Петроградский";"Спортивная";"197198, г.Санкт-Петербург, улица Блохина, дом 9, литера А";"Апартамент-отель";"Кронверк";"";"26";"2004";"";"79857637531";"автостоянка, аренда конференц-залов, заказ такси, заказ авиа и ж/д билетов, бронирование и заказ билетов в театры, на концерты";"телевизор, кондиционер, рабочий стол, телефон, ванная комната, холодильник, фен, интернет Wi-Fi";"http://www.kronverk.com/ru";"mailto: office@kronverk.com";"3040:03:39";"52";"";"Комитет по инвестициям";"муниципальный округ Введенский"
"Отель-кафе Тайм-аут";"Курортный";"Старая Деревня";"197706, Санкт-Петербург, г. Сестрорецк, пляж Северный, д.2";"3*";"ТаймАут";"";"11";"2003";"3 400";"3376776, 3465220";"рестораны, автостоянка, заказ такси, камера хранения багажа, прачечная, химчистка";"сейф, кондиционер, радио, телефон, телевизор, фен, утюг, холодильник, кофеварка/ электрический чайник, звонок-«будильник»/ Будильник, рабочий стол, душ, туалет";"http://www.timeoutspb.ru/";"нет";"";"22";"";"Комитет по инвестициям";""
"Скандинавия";"Курортный";"Старая Деревня";"Санкт-Петербург, город Сестрорецк, Парковая улица, дом 16, литера Б";"4*";"Скандинавия";"";"76";"2001";"8 000";"4341100";"аренда конференц-залов, аренда автомобилей, услуги бизнес-центра, рестораны, автостоянка, заказ такси, фитнес-клуб, салон красоты, камера хранения багажа, прачечная, химчистка, организация туров и экскурсий, spa-комплекс, детская комната, кондитерская";"сейф, кондиционер, телефон, мини-бар, телевизор, спутниковое ТВ, видео, интернет Wi-Fi, фен, утюг, холодильник, кофеварка/ электрический чайник, халат, тапочки, банные принадлежности, гладильные принадлежности, звонок-«будильник»/ Будильник, круглосуточно";"http://www.skandinavia.ru";"mailto: skandinavia@skandinavia.ru";"11125В:1:21";"122";"";"Комитет по инвестициям";"город Сестрорецк"
"Тарховский военный санаторий";"Курортный";"Старая Деревня";"Санкт-Петербург, город Сестрорецк, Тарховский проспект, дом 24, литера А";"Пансионат";"ГУ "Тарховский военный санаторий"";"";"280";"";"1 200";"4371581, 4376511";"автостоянка, заказ такси, бильярд, теннисный корт, дискотека, сауна";"телевизор";"http://www.812tarhovka.ru";"mailto: info@812tarhovka.ru";"11225:0:45";"505";"";"Комитет по инвестициям";"город Сестрорецк"
"Крона";"Курортный";"Проспект Просвещения";"Санкт-Петербург, поселок Песочный, улица Карла Маркса, дом 58, литера А";"3*";"Крона";"";"30";"2003";"3 400";"5966412, 596 6449";"автостоянка, заказ такси, заказ авиа и ж/д билетов, бильярд, кафе, русская баня";"телевизор, фен, утюг, холодильник, рабочий стол, душ, туалет, ванная комната";"http://www.hotelkrona.narod.ru";"mailto: home_krona@mail.ru ";"21307:4:34";"60";"";"Комитет по инвестициям";"поселок Песочный"
"Форт Р";"Выборгский";"Озерки";"194362, Санкт-Петербург, поселок Парголово, улица Шишкина, дом 64, корпус 2, литера А";"Мини-гостиница";"Форт Р";"";"6";"2007";"2 800";"5974612, 5974746, 5974704, 9216535";"рестораны, заказ такси, фитнес-клуб, салон красоты, камера хранения багажа, fавтостоянка";"кондиционер, телефон, телевизор, ,банные принадлежности";"http://www.fortr.ru/";"mailto: fortr@yandex.ru";"13224:4:153";"13";"";"Комитет по инвестициям";"поселок Парголово"
"Ретур";"Курортный";"Старая Деревня";"Санкт-Петербург, город Сестрорецк, Большая Купальная улица, дом 28, литера А";"Эконом класс";"Ретур";"";"28";"2000";"3 200";"4377533, 4345022";"рестораны, заказ такси, сауна, бар, бассейн, бильярд, теннисный корт";"телефон, телевизор, душ, туалет";"http://www.retur-motel.ru";"mailto: reception@retur-motel.ru";"11353:10:1";"76";"";"Комитет по инвестициям";"город Сестрорецк"
"Черное и белое";"Курортный";"Старая Деревня";"Санкт-Петербург, город Сестрорецк, Приморское шоссе, дом 238, литера А";"Мини-гостиница";"“Черное и Белое”";"";"7";"2006";"3 100";"4347188";"аренда автомобилей, визовая поддержка, услуги бизнес-центра, рестораны, автостоянка, заказ такси, фитнес-клуб, салон красоты, сувенирные магазины, камера хранения багажа, прачечная, химчистка, заказ авиа и ж/д билетов, организация туров и экскурсий, брони";"телефон, телевизор, спутниковое ТВ, банные принадлежности, звонок-«будильник»/ будильник, круглосуточное обслуживание в номере, рабочий стол, душ, ванна, туалет";"http://www.kafeotel.ru";"нет";"11357:24:45";"14";"";"Комитет по инвестициям";"город Сестрорецк"
"Лисья нора";"Приморский";"Старая Деревня";"Санкт-Петербург, поселок Лисий Нос, Ленинградское шоссе, дом 38, литера А";"Мини-гостиница";"Лисья нора";"";"4";"2001";"5 000";"4348759";"рестораны, автостоянка, заказ такси, сувенирные магазины, камера хранения багажа, прачечная, химчистка, заказ авиа и ж/д билетов, организация туров и экскурсий, бронирование и заказ билетов в театры, на концерты";"кондиционер, радио, телефон, телевизор, спутниковое ТВ, интернет Wi-Fi, круглосуточное обслуживание в номере, рабочий стол, туалет, ванная комната";"http://www.lisyanora.spb.ru/";"mailto: lisyanora@inbox.ru";"4441А:16:22";"10";"";"Комитет по инвестициям";"поселок Лисий Нос"
"База отдыха ГП "Интерьер"";"Приморский";"Старая Деревня";"189645, Санкт-Петербург, поселок Лисий Нос, Деловая улица, дом 17/18, литера А-а7";"Эконом класс База отдыха";"";"";"24";"1974";"";"4349789";"визовая поддержка, услуги бизнес-центра, рестораны";"";"нет";"";"4418:03:03";"0";"";"Комитет по инвестициям";"поселок Лисий Нос"
