"Гринвич";"Центральный";"Площадь Восстания/Маяковская";"191014, г.Санкт-Петербург, Ковенский переулок, дом 14, литера А";"Мини-гостиница";"ИП Морева Ольга Анатольевна";"Петербургские отели";"8";"2008";"";"2730817";"визовая поддержка, заказ такси, прачечная, химчистка, заказ авиа и ж/д билетов, организация туров и экскурсий, бронирование и заказ билетов в театры, на концерты";"кондиционер, телефон, телевизор, кабельное ТВ, интернет Wi-Fi, фен, утюг, круглосуточное обслуживание в номере, душ";"http://www.vashpiter.ru/,  http://www.greenwich-hotel.ru/";"mailto: mail@greenwich-hotel.ru";"1217:05:42";"20";"";"Комитет по инвестициям";"муниципальное образование Литейный округ"
"Лира";"Фрунзенский";"Обводный канал";"192007, г.Санкт-Петербург, Днепропетровская улица, дом 57, литера А";"Эконом класс";"Лира";"";"43";"2006";"3 400";"3359100";"рестораны, автостоянка, заказ такси, камера хранения багажа, заказ авиа и ж/д билетов, организация туров и экскурсий, бронирование и заказ билетов в театры, на концерты, сауна, бильярд";"кондиционер, телефон, телевизор, кабельное ТВ, тапочки, круглосуточное обслуживание в номере, ванная комната";"http://www.lyra-hotel.ru/";"mailto: lyra@lyra-hotel.ru";"7309:3003:57";"86";"";"Комитет по инвестициям";"муниципальный округ Волковское"
"Doma.ru";"Центральный";"Площадь Восстания/Маяковская";"191040, г.Санкт-Петербург, улица Марата, дом 22-24, литера А";"Мини-гостиница";"Doma.ru";"";"4";"2007";"";"5757561";"заказ такси, камера хранения багажа, прачечная, химчистка, заказ авиа и ж/д билетов";"телефон, телевизор, кабельное ТВ, интернет Wi-Fi, фен, утюг, душ";"http://www.hotel-doma.ru";"mailto:doma.spb@mail.ru";"1131:2:100";"8";"";"Комитет по инвестициям";"муниципальное образование Владимирский округ"
"Алекс-Отель";"Центральный";"Владимирская/Достоевская";"191040, г.Санкт-Петербург, улица Марата, дом 22-24, литера А";"Мини-гостиница";"Алекс Отель";"сеть мини-отелей "Алекс Отель»";"8";"2007";"";"4687777";"заказ такси, заказ авиа и ж/д билетов, организация туров и экскурсий, бронирование и заказ билетов в театры, на концерты";"сейф, кондиционер, телефон, телевизор, видео, интернет Wi-Fi, банные принадлежности, круглосуточное обслуживание в номере, душ, туалет";"http://www.motelspb.com/,  http://www.alexhotels.ru";"mailto: aleks-hotel@mail.ru";"1131:2:100";"16";"";"Комитет по инвестициям";"муниципальное образование Владимирский округ"
"Кристоф отель";"Центральный";"Пушкинская/Звенигородская";"191002, г.Санкт-Петербург, Загородный проспект, дом 9, литера А";"3*";"Кристоф Отель";"";"21";"2003";"3 400";"5713692";"визовая поддержка, услуги бизнес-центра, автостоянка, заказ такси, камера хранения багажа, прачечная, химчистка, бронирование и заказ билетов в театры, на концерты";"сейф, кондиционер, телефон, телевизор, фен, утюг, холодильник, кофеварка/ электрический чайник, гладильные принадлежности, звонок-«будильник»/ Будильник, кухня, душ, туалет";"http://www.kristoff.ru";"mailto: reservation@kristoff.ru";"1054:01:04";"42";"";"Комитет по инвестициям";"муниципальное образование Владимирский округ"
"Скай хостел (Sky hostel)";"Центральный";"Владимирская/Достоевская";"191002, г.Санкт-Петербург, Владимирский проспект, дом 15, литера А";"Хостел";"Скай хостел";"";"5";"2010";"";"8-921-302-77-77, 8-952-211-03-41";"копировальные услуги, вызов такси, заказ театральных билетов, авиа и ж/д билетов, организация экскурсий";"кровати, Wi-Fi интернет";"http://www.skyhostel.ru";"mailto: info@skyhostel.ru";"1136:01:02";"32";"";"Комитет по инвестициям";"муниципальное образование Владимирский округ"
"Park Inn Nevskiy";"Центральный";"Площадь Восстания/Маяковская";"193036, г.Санкт-Петербург, Невский проспект, дом 91, литера Б";"4*";"Феникс отель";"Rezidor Hotel Group (Park Inn)";"270";"2010";"9 200";"3310460";"бар-ресторан, фитнес-центр, аренда конференц-залов, автостоянка";"телевизор, интернет, климат-контроль, спутниковое телевидение, сейф, фен, ванные принадлежности";"http://www.parkinn.ru";"mailto: Reservations.LEDPN@rezidorparkinn.com";"1497:16:30";"540";"";"Комитет по инвестициям";"муниципальное образование Лиговка-Ямская"
"Невский берег";"Центральный";"Площадь Восстания/Маяковская";"193036, г.Санкт-Петербург, Невский проспект, дом 93, литера А";"3*";"Невский берег";"";"28";"2007";"3 800";"7174160, 4413943";"визовая поддержка, заказ такси, прачечная, химчистка, заказ авиа и ж/д билетов, организация туров и экскурсий, бронирование и заказ билетов в театры, на концерты";"кондиционер, телевизор, кабельное ТВ, интернет Wi-Fi, фен, утюг, душ";"http://www.nevskybereg.ru/";"mailto: nevskybereg@inbox.ru";"1497:08:34";"52";"";"Комитет по инвестициям";"муниципальное образование Лиговка-Ямская"
"Камея";"Адмиралтейский";"Пушкинская/Звенигородская";"191180, г.Санкт-Петербург, набережная реки Фонтанки, дом 90, корпус 6";"Мини-гостиница Эконом класс";"ПСП";"";"46";"2005";"6 000";"3144237, 312 0858";"заказ такси, камера хранения багажа, прачечная хим";"";"www.cameohotel.ru";"mailto: info@cameohotel.ru";"1622:1:61";"90";"";"Комитет по инвестициям";"муниципальный округ Семеновский"
"Отель на Гороховой";"Адмиралтейский";"Сенная площадь/Садовая/Спасская";"190031, г.Санкт-Петербург, Гороховая улица, дом 39, литера А";"Мини-гостиница";"ОНИКС";"ОНИКС";"7";"2008";"";"3101198, 4046247";"заказ такси, организация туров и экскурсий";"телефон, телевизор, интернет Wi-Fi, звонок-«будильник»/ Будильник, круглосуточное обслуживание в номере, рабочий стол, душ, туалет";"нет";"mailto: hostel-88@mail.ru";"1145:15:39";"14";"";"Комитет по инвестициям";"муниципальное образование Сенной округ"
"Норд Хостел Казанский";"Центральный";"Невский проспект/Гостиный двор";"г.Санкт-Петербург, Мучной переулок, дом 5";"Хостел";"Норд Хостел";"Норд Хостел";"5";"2010";"";"5710342: 89119854595, 3127302";"автостоянка, заказ такси, камера хранения багажа, прачечная, химчистка, организация туров и экскурсий";"сейф, кондиционер, интернет Wi-Fi, круглосуточное обслуживание в номере, рабочий стол, душ, туалет";"http://www.nordhostel.com";"mailto: info@nordhostel.com";"1144:00:13";"22";"";"Комитет по инвестициям";"муниципальный округ №78"
"ОАО "Учебный комбинат"";"Невский";"Елизаровская";"193029, г.Санкт-Петербург, переулок Ногина, дом 5, литера В";"Эконом класс";"Учебный комбинат";"";"35";"1980";"";"3651467, 3650657";"автостоянка, заказ такси, камера хранения багажа, прачечная, химчистка";"сейф, телефон, телевизор, фен, утюг, холодильник, кофеварка/ электрический чайник, гладильные принадлежности, звонок-«будильник»/ Будильник, кухня, рабочий стол, душ, туалет";"нет";"нет";"7117:20:43";"70";"";"Комитет по инвестициям";"муниципальный округ №49"
"А-Тур Петербург";"Центральный";"Площадь Александра Невского";"г.Санкт-Петербург, улица Александра Невского, дом 4, литера А";"Эконом класс Мини-гостиница";"";"";"4";"";"";"9736696";"Заказ такси, прачечная, химчистк, бронирование";"";"нет";"";"1500:2005:8";"0";"";"Комитет по инвестициям";"муниципальное образование Смольнинское"
"Москва";"Центральный";"Площадь Александра Невского";"г.Санкт-Петербург, площадь Александра Невского, дом 2, литера Е";"4*";"Москва";"";"825";"2007";"5 700";"3332444";"аренда конференц-залов, аренда автомобилей, услуги бизнес-центра, заказ такси, салон красоты, камера хранения багажа, ресторан, прачечная,химчистка, заказ авиа и ж/д билетов";"сейф, кондиционер, радио, телефон, мини-бар, телевизор, спутниковое ТВ, кабельное ТВ, интернет Wi-Fi, фен, утюг, банные принадлежности, гладильные принадлежности, круглосуточное обслуживание в номере, размещение домашних животных, рабочий стол, душ, ванна";"http://www.hotel-moscow.ru";"mailto: reservation@hotel-moscow.ru";"1501:27:38";"0";"";"Комитет по инвестициям";"муниципальное образование Смольнинское"
"B&B Сенная";"Адмиралтейский";"Сенная площадь/Садовая/Спасская";"г.Санкт-Петербург, Сенная площадь, дом 13, литера А";"Мини-гостиница";"B&B Сенная";"Randhouse";"7";"2001";"3 400";"3107005";"визовая поддержка, рестораны, заказ такси, сувенирные магазины, камера хранения багажа, прачечная, химчистка, заказ авиа и ж/д билетов, организация туров и экскурсий";"сейф, кондиционер, телефон, мини-бар, телевизор, спутниковое ТВ, интернет Wi-Fi, фен, халат, тапочки, банные принадлежности, звонок-«будильник»/ Будильник, круглосуточное обслуживание в номере, рабочий стол, туалет, ванная комната";"http://www.randhouse.ru";"mailto: randhouse@mail.ru";"1147:02:01";"14";"";"Комитет по инвестициям";"муниципальное образование Сенной округ"
"SPb Hostel";"Адмиралтейский";"Сенная площадь/Садовая/Спасская";"190031, г.Санкт-Петербург, Московский проспект, дом 4, литера А";"Хостел";"Crazy Duck hostel";"";"7";"2008";"";"3101304";"камера хранения багажа, Интернет, холодильник, тв, телефон, фен, утюг, стиральная машина, посудомоечная машина, визовая поддержка, регистрация иностранцев, заказ такси";"wi-fi, сейфовые ячейки";"http://www.hostel-petersburg.ru/";"mailto: booking@spb-hostel.ru";"1059:01:07";"35";"";"Комитет по инвестициям";"муниципальное образование Сенной округ"
"Агат";"Центральный";"Площадь Восстания/Маяковская";"г.Санкт-Петербург, Пушкинская улица, дом 18, литера А";"Мини-гостиница Эконом класс";"";"";"44";"";"";"9910292";"";"";"нет";"";"1046:2003:3";"0";"";"Комитет по инвестициям";"муниципальное образование Владимирский округ"
"Автограф";"Центральный";"Сенная площадь/Садовая/Спасская";"191119, г.Санкт-Петербург, Лиговский проспект, дом 44, литера Б";"Мини-гостиница";"Автограф";"";"7";"2008";"";"6002195, 9134315";"визовая поддержка, заказ такси, организация туров и экскурсий, бронирование и заказ билетов в театры, на концерты";"радио, телефон, телевизор, интернет Wi-Fi, душ, ванная комната";"http://www.avtografhotel.ru";"mailto: reservation@avtograf-hotel.ru ";"1521:2011:130";"14";"";"Комитет по инвестициям";"муниципальное образование Лиговка-Ямская"
"Акварели";"Центральный";"Площадь Восстания/Маяковская";"193036, г.Санкт-Петербург, Невский проспект, дом 136, литера А";"Мини-гостиница";"Акварели";"";"9";"2008";"";"7179203, 7171087";"визовая поддержка, заказ такси, заказ авиа и ж/д билетов";"кондиционер, телефон, спутниковое ТВ, кабельное ТВ, интернет Wi-Fi, душ";"http://www.akvarelihotel.ru/";"mailto: info2@akvarelihotel.ru";"1493:06:28";"18";"";"Комитет по инвестициям";"муниципальное образование Смольнинское"
"Акме";"Центральный";"Владимирская/Достоевская";"г.Санкт-Петербург, улица Рубинштейна, дом 23, литера А";"Мини-гостиница";"Акме";"Акме";"5";"2007";"";"5758233, 6002080";"аренда автомобилей, визовая поддержка, организация туров и экскурсий";"сейф, телефон, спутниковое ТВ, видео, интернет Wi-Fi, фен, холодильник, банные принадлежности, гладильные принадлежности, душ, ванна, туалет, ванная комната";"http://www.acme-hotel.com/";"mailto: rb@acme-hotel.com";"1055:9:71";"13";"";"Комитет по инвестициям";"муниципальное образование Владимирский округ"
"Акцент";"Московский";"Фрунзенская";"г.Санкт-Петербург, Киевская улица, дом 24/22, литера А";"3*";"Акцент";"Акцент";"26";"2008";"2 400";"7467114, 7467180";"аренда автомобилей, визовая поддержка, заказ такси, камера хранения багажа, заказ авиа и ж/д билетов, организация туров и экскурсий, бронирование и заказ билетов в театры, на концерты, кафе, прачечная";"телефон, телевизор, интернет Wi-Fi, фен, утюг, холодильник, кофеварка/ электрический чайник, гладильные принадлежности, звонок-«будильник»/ Будильник, рабочий стол, душ, туалет, ванная комната";"http://www.accent-hotel.ru/";"mailto: info@accent-hotel.ru";"7521:0:282";"57";"";"Комитет по инвестициям";"муниципальное образование Московская застава"
"Александер Платц";"Фрунзенский";"Обводный канал";"192007, г.Санкт-Петербург, Воронежская улица, дом 53, корпус 1, литера А";"3*";"Группа Отелей Евразия";"Евразия";"35";"2006";"3 400";"4904810, 4904811";"визовая поддержка, рестораны, заказ такси, камера хранения багажа, прачечная, химчистка, заказ авиа и ж/д билетов, организация туров и экскурсий, бронирование и заказ билетов в театры, на концерты, сауна с бассейном";"сейф, кондиционер, телефон, телевизор, кабельное ТВ, интернет Wi-Fi, ванная комната";"http://www.eurasia-hotel.ru/";"mailto: alp@eurasia-hotel.ru";"7313:04:25";"70";"";"Комитет по инвестициям";"муниципальный округ Волковское"
"Александрия";"Адмиралтейский";"Сенная площадь/Садовая/Спасская";"г.Санкт-Петербург, Спасский переулок, дом 6-8, литера А";"Мини-гостиница";"Soko Hotels";"Soko Hotels";"11";"2008";"3 400";"3108531, 3108534";"аренда конференц-залов, заказ такси, камера хранения багажа, прачечная, химчистка, заказ авиа и ж/д билетов, организация туров и экскурсий";"телефон, телевизор, интернет Wi-Fi, фен, халат, тапочки, банные принадлежности, звонок-«будильник»/ Будильник, круглосуточное обслуживание в номере, рабочий стол, туалет, ванная комната";"http://www.alexhotel.ru/";"mailto: booking@alexhotel.ru";"1145:04:43";"22";"";"Комитет по инвестициям";"муниципальное образование Сенной округ"
"Анабель Тур";"Центральный";"Площадь Александра Невского";"193024, г.Санкт-Петербург, Невский проспект, дом 147, литера А";"Мини-гостиница";"Анабель-Тур";"Анабель";"15";"2003";"";"7177752, 7170800";"аренда автомобилей, визовая поддержка, автостоянка, заказ авиа и ж/д билетов, организация туров и экскурсий, бронирование и заказ билетов в театры, на концерты";"кондиционер, телефон, мини-бар, спутниковое ТВ, интернет Wi-Fi, душ, ванная комната";"http://www.anabel.ru/";"mailto: hotel@anabel.ru";"1499:06:02";"36";"";"Комитет по инвестициям";"муниципальное образование Лиговка-Ямская"
"Апарт-отель "Невский 150"";"Центральный";"Площадь Восстания/Маяковская, Площадь Александра Невского";"г.Санкт-Петербург, Невский проспект, дом 150, литера Е";"Мини-гостиница 3*";"";"";"4";"2007";"";"7171219, 7178934";"заказ авиа и ж/д билетов, бронирование и заказ бил";"";"http://www.nevsky150.ru/";"";"1488:01:14";"0";"";"Комитет по инвестициям";"муниципальное образование Смольнинское"
"Атлас";"Центральный";"Площадь Восстания/Маяковская";"193036, г.Санкт-Петербург, Невский проспект, дом 95, литера А";"Мини-гостиница";"LUXA";"Сеть отелей Luxa";"10";"2005";"";"7777888";"аренда автомобилей, визовая поддержка, автостоянка, заказ такси, камера хранения багажа, бронирование и заказ билетов в театры, на концерты";"телевизор, круглосуточное обслуживание в номере";"http://www.luxa.ru/";"mailto: spbflat@bk.ru";"1497:03:01";"22";"";"Комитет по инвестициям";"муниципальное образование Лиговка-Ямская"
"Атмосфера";"Центральный";"Площадь Восстания/Маяковская";"193036, г.Санкт-Петербург, Невский проспект, дом 132, литера Б";"Мини-гостиница";"Сеть отелей "Атмосфера"";"Сеть отелей "Атмосфера"";"5";"2007";"";"9747523";"аренда автомобилей, визовая поддержка, заказ такси, камера хранения багажа, заказ авиа и ж/д билетов, бронирование и заказ билетов в театры, на концерты";"халат, тапочки, банные принадлежности, круглосуточное обслуживание в номере, рабочий стол, душ, ванная комната";"http://www.a-hotel.spb.ru/";"mailto: a-hotel@mail.ru";"1493:14:02";"15";"";"Комитет по инвестициям";"муниципальное образование Смольнинское"
"Атмосфера";"Центральный";"Площадь Александра Невского";"г.Санкт-Петербург, Невский проспект, дом 163, литера А";"Мини-гостиница";"Сеть отелей "Атмосфера"";"Сеть отелей "Атмосфера"";"7";"2006";"";"9747523";"аренда автомобилей, визовая поддержка, заказ такси, камера хранения багажа, заказ авиа и ж/д билетов, бронирование и заказ билетов в театры, на концерты";"кондиционер, телевизор, интернет Wi-Fi, фен, холодильник, халат, тапочки, банные принадлежности, круглосуточное обслуживание в номере, рабочий стол, душ, ванная комната";"http://www.a-hotel.spb.ru/";"mailto: a-hotel@mail.ru";"1512:2003:60";"16";"";"Комитет по инвестициям";"муниципальное образование Лиговка-Ямская"
"Староневский";"Центральный";"Площадь Восстания/Маяковская";"193036, г.Санкт-Петербург, Невский проспект, дом 107, литера А";"Хостел";"Староневский";"";"5";"2008";"";"9834709, 9832152";"вызов такси, организация туров и экскусий, прачечн";"";"http://www.selena-renta.spb.ru/";"mailto: nevsky-107@mail.ru";"1497:05:09";"22";"";"Комитет по инвестициям";"муниципальное образование Лиговка-Ямская"
